{
   "$id": "mensions",
   "description": "Mensions to someone",
   "icon": "bi:at",
   "specs": {
      "view": {
         "properties": {
            "mentionName": {
               "type": "string"
            }
         }
      }
   },
   "services": {
      "view.lexical": "./MentionNode#MentionNode",
      "addon.lexical": "./MentionsPlugin"
   }
}