{
   "$id": "tweet",
   "description": "Embed tweet",
   "icon": "bi:twitter",
   "specs": {
      "view": {
         "properties": {
            "tweetID": {
               "type": "string",
               "examples": "https://twitter.com/jack/status/20"
            }
         }
      }
   },
   "services": {
      "view.react": "./Tweet#TweetComponent"
   }
}