{
   "$id": "layout.columns",
   "title": "Columns Layout",
   "description": "Display content as columns layout",
   "icon": "bi:layout-three-columns",
   "specs": {
      "view": {
         "properties": {
            "templateColumns": {
               "type": "string",
               "default": "1fr 1fr"
            }
         }
      }
   },
   "services": {
      "view.lexical": "./LayoutContainerNode#LayoutContainerNode",
      "addon.lexical": "./LayoutPlugin"
   }
}