{
   "$id": "equation",
   "description": "Display math equation",
   "icon": "bi:math",
   "specs": {
      "view": {
         "properties": {
            "equation": {
               "type": "string"
            },
            "inline": {
               "type": "boolean",
               "default": true
            }
         }
      }
   },
   "services": {
      "view.react": "./EquationComponent#EquationComponent"
   }
}