{
   "$id": "my.comp1",
   "description": "my comp1",
   "icon": "bi:scissors",
   "specs": {
      "view": {
         "properties": {
            "propA": {
               "type": "string"
            },
            "propB": {
               "type": "number"
            },
            "propC": {
               "type": "array",
               "items": {
                  "type": "string"
               }
            },
            "propD": {
               "type": "display"
            }
         }
      }
   },
   "services": {
      "view.react": "."
   }
}