{
   "$id": "figma",
   "description": "Display figma diagram",
   "icon": "bi:figma",
   "specs": {
      "view": {
         "properties": {
            "documentID": {
               "type": "string"
            }
         }
      }
   },
   "services": {
      "view.react": "./Figma#FigmaComponent"
   }
}