{
   "$id": "list",
   "description": "List",
   "specs": {
      "view": {
         "properties": {
            "children": {
               "type": "array",
               "items": {
                  "type": "display"
               }
            }
         }
      }
   },
   "services": {
      "view.web": "./HtmlList#List",
      "view.web.editor": "./HtmlList#ListEditor"
   }
}