{
   "$id": "image",
   "description": "Display image with caption",
   "icon": "bi:card-image",
   "specs": {
      "view": {
         "properties": {
            "src": {
               "type": "string"
            }
         }
      }
   },
   "services": {
      "view.lexical": "./ImageNode#ImageNode",
      "addon.lexical": "./ImagesPlugin"
   }
}